{
  "entities": [
    {
      "id": "entity_0",
      "ifc_type": "IfcCovering",
      "name": "Compound Ceiling:Gypsum Board:187675",
      "position": [
        0.0,
        0.0,
        0.0
      ],
      "attributes": {
        "ObjectType": "Compound Ceiling:Gypsum Board",
        "Tag": "187675",
        "PredefinedType": "CEILING"
      }
    },
    {
      "id": "entity_1",
      "ifc_type": "IfcSpace",
      "name": "R301",
      "position": [
        2.0,
        0.0,
        0.0
      ],
      "attributes": {
        "LongName": "Roof",
        "CompositionType": "ELEMENT",
        "InteriorOrExteriorSpace": "INTERNAL"
      }
    },
    {
      "id": "entity_2",
      "ifc_type": "IfcBuildingStorey",
      "name": "Level 2",
      "position": [
        4.0,
        0.0,
        0.0
      ],
      "attributes": {
        "CompositionType": "ELEMENT",
        "Elevation": 3.100000000000378
      }
    },
    {
      "id": "entity_3",
      "ifc_type": "IfcSpace",
      "name": "B103",
      "position": [
        6.0,
        0.0,
        0.0
      ],
      "attributes": {
        "LongName": "Kitchen",
        "CompositionType": "ELEMENT",
        "InteriorOrExteriorSpace": "INTERNAL"
      }
    },
    {
      "id": "entity_4",
      "ifc_type": "IfcSpace",
      "name": "A103",
      "position": [
        8.0,
        0.0,
        0.0
      ],
      "attributes": {
        "LongName": "Kitchen",
        "CompositionType": "ELEMENT",
        "InteriorOrExteriorSpace": "INTERNAL"
      }
    },
    {
      "id": "entity_5",
      "ifc_type": "IfcOpeningElement",
      "name": "M_Counter Top w Sink Hole:600mm Depth:600mm Depth:162490:1",
      "position": [
        10.0,
        0.0,
        0.0
      ],
      "attributes": {
        "ObjectType": "Opening",
        "Tag": "162490"
      }
    },
    {
      "id": "entity_6",
      "ifc_type": "IfcOpeningElement",
      "name": "M_Counter Top w Sink Hole:600mm Depth:600mm Depth:161165:1",
      "position": [
        12.0,
        0.0,
        0.0
      ],
      "attributes": {
        "ObjectType": "Opening",
        "Tag": "161165"
      }
    },
    {
      "id": "entity_7",
      "ifc_type": "IfcBuildingStorey",
      "name": "Roof",
      "position": [
        14.0,
        0.0,
        0.0
      ],
      "attributes": {
        "CompositionType": "ELEMENT",
        "Elevation": 6.00000000000039
      }
    },
    {
      "id": "entity_8",
      "ifc_type": "IfcFurnishingElement",
      "name": "M_Counter Top w Sink Hole:600mm Depth:600mm Depth:162490",
      "position": [
        16.0,
        0.0,
        0.0
      ],
      "attributes": {
        "ObjectType": "600mm Depth",
        "Tag": "162490"
      }
    },
    {
      "id": "entity_9",
      "ifc_type": "IfcFurnishingElement",
      "name": "M_Counter Top w Sink Hole:600mm Depth:600mm Depth:161165",
      "position": [
        18.0,
        0.0,
        0.0
      ],
      "attributes": {
        "ObjectType": "600mm Depth",
        "Tag": "161165"
      }
    }
  ],
  "relations": [
    {
      "type": "IfcRelContainedInSpatialStructure",
      "from": "entity_2",
      "to": "entity_0",
      "attributes": {}
    },
    {
      "type": "IfcRelContainedInSpatialStructure",
      "from": "entity_3",
      "to": "entity_9",
      "attributes": {}
    },
    {
      "type": "IfcRelContainedInSpatialStructure",
      "from": "entity_4",
      "to": "entity_8",
      "attributes": {}
    },
    {
      "type": "IfcRelAggregates",
      "from": "entity_7",
      "to": "entity_1",
      "attributes": {}
    },
    {
      "type": "IfcRelVoidsElement",
      "from": "entity_8",
      "to": "entity_5",
      "attributes": {}
    },
    {
      "type": "IfcRelVoidsElement",
      "from": "entity_9",
      "to": "entity_6",
      "attributes": {}
    }
  ],
  "attributes": {
    "entity_0": {
      "ObjectType": "Compound Ceiling:Gypsum Board",
      "Tag": "187675",
      "PredefinedType": "CEILING"
    },
    "entity_1": {
      "LongName": "Roof",
      "CompositionType": "ELEMENT",
      "InteriorOrExteriorSpace": "INTERNAL"
    },
    "entity_2": {
      "CompositionType": "ELEMENT",
      "Elevation": 3.100000000000378
    },
    "entity_3": {
      "LongName": "Kitchen",
      "CompositionType": "ELEMENT",
      "InteriorOrExteriorSpace": "INTERNAL"
    },
    "entity_4": {
      "LongName": "Kitchen",
      "CompositionType": "ELEMENT",
      "InteriorOrExteriorSpace": "INTERNAL"
    },
    "entity_5": {
      "ObjectType": "Opening",
      "Tag": "162490"
    },
    "entity_6": {
      "ObjectType": "Opening",
      "Tag": "161165"
    },
    "entity_7": {
      "CompositionType": "ELEMENT",
      "Elevation": 6.00000000000039
    },
    "entity_8": {
      "ObjectType": "600mm Depth",
      "Tag": "162490"
    },
    "entity_9": {
      "ObjectType": "600mm Depth",
      "Tag": "161165"
    }
  },
  "containment": [
    {
      "entity": "entity_0",
      "container": "entity_2"
    },
    {
      "entity": "entity_9",
      "container": "entity_3"
    },
    {
      "entity": "entity_8",
      "container": "entity_4"
    }
  ],
  "connectivity": [],
  "constraints": [
    "entity_2 IfcRelContainedInSpatialStructure entity_0",
    "entity_3 IfcRelContainedInSpatialStructure entity_9",
    "entity_4 IfcRelContainedInSpatialStructure entity_8",
    "entity_7 IfcRelAggregates entity_1",
    "entity_8 IfcRelVoidsElement entity_5",
    "entity_9 IfcRelVoidsElement entity_6"
  ],
  "generation_prompt": "Generate a submersible pump. Technical 3D scene containing IfcBuildingStorey, IfcCovering, IfcFurnishingElement, IfcOpeningElement, IfcSpace",
  "prompt_id": "T1-MEP-008",
  "prompt": "Generate a submersible pump",
  "tier": 1,
  "domain": "MEP"
}