{
  "entities": [
    {
      "id": "entity_0",
      "ifc_type": "IfcOpeningElement",
      "name": "",
      "position": [
        0.0,
        0.0,
        0.0
      ],
      "attributes": {
        "ObjectType": "Opening",
        "Tag": "185337"
      }
    },
    {
      "id": "entity_1",
      "ifc_type": "IfcSpace",
      "name": "B205",
      "position": [
        2.0,
        0.0,
        0.0
      ],
      "attributes": {
        "LongName": "Utility",
        "CompositionType": "ELEMENT",
        "InteriorOrExteriorSpace": "INTERNAL"
      }
    },
    {
      "id": "entity_2",
      "ifc_type": "IfcSpace",
      "name": "A205",
      "position": [
        4.0,
        0.0,
        0.0
      ],
      "attributes": {
        "LongName": "Utility",
        "CompositionType": "ELEMENT",
        "InteriorOrExteriorSpace": "INTERNAL"
      }
    },
    {
      "id": "entity_3",
      "ifc_type": "IfcRoof",
      "name": "Basic Roof:Live Roof over Wood Joist Flat Roof:184483",
      "position": [
        6.0,
        0.0,
        0.0
      ],
      "attributes": {
        "ObjectType": "Basic Roof:Live Roof over Wood Joist Flat Roof",
        "Tag": "184483",
        "ShapeType": "NOTDEFINED"
      }
    },
    {
      "id": "entity_4",
      "ifc_type": "IfcOpeningElement",
      "name": "Basic Roof:Live Roof over Wood Joist Flat Roof:184483:3",
      "position": [
        8.0,
        0.0,
        0.0
      ],
      "attributes": {
        "ObjectType": "Opening",
        "Tag": "184483"
      }
    },
    {
      "id": "entity_5",
      "ifc_type": "IfcBuildingStorey",
      "name": "Level 2",
      "position": [
        10.0,
        0.0,
        0.0
      ],
      "attributes": {
        "CompositionType": "ELEMENT",
        "Elevation": 3.100000000000378
      }
    },
    {
      "id": "entity_6",
      "ifc_type": "IfcOpeningElement",
      "name": "",
      "position": [
        12.0,
        0.0,
        0.0
      ],
      "attributes": {
        "ObjectType": "Opening",
        "Tag": "185718"
      }
    },
    {
      "id": "entity_7",
      "ifc_type": "IfcSlab",
      "name": "Basic Roof:Live Roof over Wood Joist Flat Roof:184483",
      "position": [
        14.0,
        0.0,
        0.0
      ],
      "attributes": {
        "ObjectType": "Basic Roof:Live Roof over Wood Joist Flat Roof",
        "Tag": "184483",
        "PredefinedType": "ROOF"
      }
    }
  ],
  "relations": [
    {
      "type": "IfcRelAggregates",
      "from": "entity_3",
      "to": "entity_7",
      "attributes": {}
    },
    {
      "type": "IfcRelVoidsElement",
      "from": "entity_3",
      "to": "entity_0",
      "attributes": {}
    },
    {
      "type": "IfcRelVoidsElement",
      "from": "entity_3",
      "to": "entity_6",
      "attributes": {}
    },
    {
      "type": "IfcRelAggregates",
      "from": "entity_5",
      "to": "entity_2",
      "attributes": {}
    },
    {
      "type": "IfcRelAggregates",
      "from": "entity_5",
      "to": "entity_1",
      "attributes": {}
    },
    {
      "type": "IfcRelVoidsElement",
      "from": "entity_7",
      "to": "entity_4",
      "attributes": {}
    }
  ],
  "attributes": {
    "entity_0": {
      "ObjectType": "Opening",
      "Tag": "185337"
    },
    "entity_1": {
      "LongName": "Utility",
      "CompositionType": "ELEMENT",
      "InteriorOrExteriorSpace": "INTERNAL"
    },
    "entity_2": {
      "LongName": "Utility",
      "CompositionType": "ELEMENT",
      "InteriorOrExteriorSpace": "INTERNAL"
    },
    "entity_3": {
      "ObjectType": "Basic Roof:Live Roof over Wood Joist Flat Roof",
      "Tag": "184483",
      "ShapeType": "NOTDEFINED"
    },
    "entity_4": {
      "ObjectType": "Opening",
      "Tag": "184483"
    },
    "entity_5": {
      "CompositionType": "ELEMENT",
      "Elevation": 3.100000000000378
    },
    "entity_6": {
      "ObjectType": "Opening",
      "Tag": "185718"
    },
    "entity_7": {
      "ObjectType": "Basic Roof:Live Roof over Wood Joist Flat Roof",
      "Tag": "184483",
      "PredefinedType": "ROOF"
    }
  },
  "containment": [],
  "connectivity": [],
  "constraints": [
    "entity_3 IfcRelAggregates entity_7",
    "entity_3 IfcRelVoidsElement entity_0",
    "entity_3 IfcRelVoidsElement entity_6",
    "entity_5 IfcRelAggregates entity_2",
    "entity_5 IfcRelAggregates entity_1",
    "entity_7 IfcRelVoidsElement entity_4"
  ],
  "generation_prompt": "Generate an energy recovery ventilator core. Technical 3D scene containing IfcBuildingStorey, IfcOpeningElement, IfcRoof, IfcSlab, IfcSpace",
  "prompt_id": "T1-HVAC-015",
  "prompt": "Generate an energy recovery ventilator core",
  "tier": 1,
  "domain": "MEP"
}