{
  "entities": [
    {
      "id": "entity_0",
      "ifc_type": "IfcStairFlight",
      "name": "Stair:Residential - 200mm Max Riser 250mm Tread:198878:1",
      "position": [
        0.0,
        0.0,
        0.0
      ],
      "attributes": {
        "ObjectType": "Stair:Residential - 200mm Max Riser 250mm Tread",
        "Tag": "198878",
        "NumberOfRiser": 16,
        "NumberOfTreads": 15,
        "RiserHeight": 0.6356627296588327,
        "TreadLength": 0.8202099737532809
      }
    },
    {
      "id": "entity_1",
      "ifc_type": "IfcMember",
      "name": "Stair:Residential - 200mm Max Riser 250mm Tread:198878:2",
      "position": [
        2.0,
        0.0,
        0.0
      ],
      "attributes": {
        "ObjectType": "stringer",
        "Tag": "198878"
      }
    },
    {
      "id": "entity_2",
      "ifc_type": "IfcRailing",
      "name": "Railing:900mm Handrail Only:198880",
      "position": [
        4.0,
        0.0,
        0.0
      ],
      "attributes": {
        "ObjectType": "Railing:900mm Handrail Only",
        "Tag": "198880",
        "PredefinedType": "NOTDEFINED"
      }
    },
    {
      "id": "entity_3",
      "ifc_type": "IfcMember",
      "name": "Stair:Residential - 200mm Max Riser 250mm Tread:151086:1",
      "position": [
        6.0,
        0.0,
        0.0
      ],
      "attributes": {
        "ObjectType": "stringer",
        "Tag": "151086"
      }
    },
    {
      "id": "entity_4",
      "ifc_type": "IfcMember",
      "name": "Stair:Residential - 200mm Max Riser 250mm Tread:151086:2",
      "position": [
        8.0,
        0.0,
        0.0
      ],
      "attributes": {
        "ObjectType": "stringer",
        "Tag": "151086"
      }
    },
    {
      "id": "entity_5",
      "ifc_type": "IfcStair",
      "name": "Stair:Residential - 200mm Max Riser 250mm Tread:151086",
      "position": [
        10.0,
        0.0,
        0.0
      ],
      "attributes": {
        "ObjectType": "Stair:Residential - 200mm Max Riser 250mm Tread",
        "Tag": "151086",
        "ShapeType": "STRAIGHT_RUN_STAIR"
      }
    },
    {
      "id": "entity_6",
      "ifc_type": "IfcRailing",
      "name": "Railing:1100mm Guard Rail:198972",
      "position": [
        12.0,
        0.0,
        0.0
      ],
      "attributes": {
        "ObjectType": "Railing:1100mm Guard Rail",
        "Tag": "198972",
        "PredefinedType": "NOTDEFINED"
      }
    },
    {
      "id": "entity_7",
      "ifc_type": "IfcBuildingStorey",
      "name": "Level 1",
      "position": [
        14.0,
        0.0,
        0.0
      ],
      "attributes": {
        "CompositionType": "ELEMENT",
        "Elevation": 0.0
      }
    },
    {
      "id": "entity_8",
      "ifc_type": "IfcStair",
      "name": "Stair:Residential - 200mm Max Riser 250mm Tread:198878",
      "position": [
        16.0,
        0.0,
        0.0
      ],
      "attributes": {
        "ObjectType": "Stair:Residential - 200mm Max Riser 250mm Tread",
        "Tag": "198878",
        "ShapeType": "STRAIGHT_RUN_STAIR"
      }
    },
    {
      "id": "entity_9",
      "ifc_type": "IfcMember",
      "name": "Stair:Residential - 200mm Max Riser 250mm Tread:198878:1",
      "position": [
        18.0,
        0.0,
        0.0
      ],
      "attributes": {
        "ObjectType": "stringer",
        "Tag": "198878"
      }
    }
  ],
  "relations": [
    {
      "type": "IfcRelAggregates",
      "from": "entity_5",
      "to": "entity_3",
      "attributes": {}
    },
    {
      "type": "IfcRelAggregates",
      "from": "entity_5",
      "to": "entity_4",
      "attributes": {}
    },
    {
      "type": "IfcRelContainedInSpatialStructure",
      "from": "entity_7",
      "to": "entity_5",
      "attributes": {}
    },
    {
      "type": "IfcRelContainedInSpatialStructure",
      "from": "entity_7",
      "to": "entity_8",
      "attributes": {}
    },
    {
      "type": "IfcRelAggregates",
      "from": "entity_8",
      "to": "entity_0",
      "attributes": {}
    },
    {
      "type": "IfcRelAggregates",
      "from": "entity_8",
      "to": "entity_9",
      "attributes": {}
    },
    {
      "type": "IfcRelAggregates",
      "from": "entity_8",
      "to": "entity_1",
      "attributes": {}
    },
    {
      "type": "IfcRelAggregates",
      "from": "entity_8",
      "to": "entity_2",
      "attributes": {}
    },
    {
      "type": "IfcRelAggregates",
      "from": "entity_8",
      "to": "entity_6",
      "attributes": {}
    }
  ],
  "attributes": {
    "entity_0": {
      "ObjectType": "Stair:Residential - 200mm Max Riser 250mm Tread",
      "Tag": "198878",
      "NumberOfRiser": 16,
      "NumberOfTreads": 15,
      "RiserHeight": 0.6356627296588327,
      "TreadLength": 0.8202099737532809
    },
    "entity_1": {
      "ObjectType": "stringer",
      "Tag": "198878"
    },
    "entity_2": {
      "ObjectType": "Railing:900mm Handrail Only",
      "Tag": "198880",
      "PredefinedType": "NOTDEFINED"
    },
    "entity_3": {
      "ObjectType": "stringer",
      "Tag": "151086"
    },
    "entity_4": {
      "ObjectType": "stringer",
      "Tag": "151086"
    },
    "entity_5": {
      "ObjectType": "Stair:Residential - 200mm Max Riser 250mm Tread",
      "Tag": "151086",
      "ShapeType": "STRAIGHT_RUN_STAIR"
    },
    "entity_6": {
      "ObjectType": "Railing:1100mm Guard Rail",
      "Tag": "198972",
      "PredefinedType": "NOTDEFINED"
    },
    "entity_7": {
      "CompositionType": "ELEMENT",
      "Elevation": 0.0
    },
    "entity_8": {
      "ObjectType": "Stair:Residential - 200mm Max Riser 250mm Tread",
      "Tag": "198878",
      "ShapeType": "STRAIGHT_RUN_STAIR"
    },
    "entity_9": {
      "ObjectType": "stringer",
      "Tag": "198878"
    }
  },
  "containment": [
    {
      "entity": "entity_5",
      "container": "entity_7"
    },
    {
      "entity": "entity_8",
      "container": "entity_7"
    }
  ],
  "connectivity": [],
  "constraints": [
    "entity_5 IfcRelAggregates entity_3",
    "entity_5 IfcRelAggregates entity_4",
    "entity_7 IfcRelContainedInSpatialStructure entity_5",
    "entity_7 IfcRelContainedInSpatialStructure entity_8",
    "entity_8 IfcRelAggregates entity_0",
    "entity_8 IfcRelAggregates entity_9",
    "entity_8 IfcRelAggregates entity_1",
    "entity_8 IfcRelAggregates entity_2",
    "entity_8 IfcRelAggregates entity_6"
  ],
  "generation_prompt": "Generate a butterfly valve. Technical 3D scene containing IfcBuildingStorey, IfcMember, IfcRailing, IfcStair, IfcStairFlight",
  "prompt_id": "T1-MEP-005",
  "prompt": "Generate a butterfly valve",
  "tier": 1,
  "domain": "MEP"
}