{
  "entities": [
    {
      "id": "entity_0",
      "ifc_type": "IfcDoor",
      "name": "M_Single-Flush:0762 x 2032mm:0762 x 2032mm:150173",
      "position": [
        0.0,
        0.0,
        0.0
      ],
      "attributes": {
        "ObjectType": "0762 x 2032mm",
        "Tag": "150173",
        "OverallHeight": 2.032,
        "OverallWidth": 0.7619999999999989
      }
    },
    {
      "id": "entity_1",
      "ifc_type": "IfcDoor",
      "name": "M_Single-Flush:0762 x 2032mm:0762 x 2032mm:150257",
      "position": [
        2.0,
        0.0,
        0.0
      ],
      "attributes": {
        "ObjectType": "0762 x 2032mm",
        "Tag": "150257",
        "OverallHeight": 2.032,
        "OverallWidth": 0.762
      }
    },
    {
      "id": "entity_2",
      "ifc_type": "IfcDoor",
      "name": "M_Single-Flush:0864 x 2032mm:0864 x 2032mm:159734",
      "position": [
        4.0,
        0.0,
        0.0
      ],
      "attributes": {
        "ObjectType": "0864 x 2032mm",
        "Tag": "159734",
        "OverallHeight": 2.032,
        "OverallWidth": 0.8639999999999995
      }
    },
    {
      "id": "entity_3",
      "ifc_type": "IfcDoor",
      "name": "M_Single-Flush:0864 x 2032mm:0864 x 2032mm:160065",
      "position": [
        6.0,
        0.0,
        0.0
      ],
      "attributes": {
        "ObjectType": "0864 x 2032mm",
        "Tag": "160065",
        "OverallHeight": 2.032,
        "OverallWidth": 0.8639999999999985
      }
    },
    {
      "id": "entity_4",
      "ifc_type": "IfcBuildingStorey",
      "name": "Level 2",
      "position": [
        8.0,
        0.0,
        0.0
      ],
      "attributes": {
        "CompositionType": "ELEMENT",
        "Elevation": 3.100000000000378
      }
    },
    {
      "id": "entity_5",
      "ifc_type": "IfcDoor",
      "name": "M_Single-Flush:0762 x 2032mm:0762 x 2032mm:203720",
      "position": [
        10.0,
        0.0,
        0.0
      ],
      "attributes": {
        "ObjectType": "0762 x 2032mm",
        "Tag": "203720",
        "OverallHeight": 2.032,
        "OverallWidth": 0.762
      }
    },
    {
      "id": "entity_6",
      "ifc_type": "IfcBuildingStorey",
      "name": "Level 1",
      "position": [
        12.0,
        0.0,
        0.0
      ],
      "attributes": {
        "CompositionType": "ELEMENT",
        "Elevation": 0.0
      }
    }
  ],
  "relations": [
    {
      "type": "IfcRelContainedInSpatialStructure",
      "from": "entity_4",
      "to": "entity_2",
      "attributes": {}
    },
    {
      "type": "IfcRelContainedInSpatialStructure",
      "from": "entity_4",
      "to": "entity_3",
      "attributes": {}
    },
    {
      "type": "IfcRelContainedInSpatialStructure",
      "from": "entity_4",
      "to": "entity_5",
      "attributes": {}
    },
    {
      "type": "IfcRelContainedInSpatialStructure",
      "from": "entity_6",
      "to": "entity_0",
      "attributes": {}
    },
    {
      "type": "IfcRelContainedInSpatialStructure",
      "from": "entity_6",
      "to": "entity_1",
      "attributes": {}
    }
  ],
  "attributes": {
    "entity_0": {
      "ObjectType": "0762 x 2032mm",
      "Tag": "150173",
      "OverallHeight": 2.032,
      "OverallWidth": 0.7619999999999989
    },
    "entity_1": {
      "ObjectType": "0762 x 2032mm",
      "Tag": "150257",
      "OverallHeight": 2.032,
      "OverallWidth": 0.762
    },
    "entity_2": {
      "ObjectType": "0864 x 2032mm",
      "Tag": "159734",
      "OverallHeight": 2.032,
      "OverallWidth": 0.8639999999999995
    },
    "entity_3": {
      "ObjectType": "0864 x 2032mm",
      "Tag": "160065",
      "OverallHeight": 2.032,
      "OverallWidth": 0.8639999999999985
    },
    "entity_4": {
      "CompositionType": "ELEMENT",
      "Elevation": 3.100000000000378
    },
    "entity_5": {
      "ObjectType": "0762 x 2032mm",
      "Tag": "203720",
      "OverallHeight": 2.032,
      "OverallWidth": 0.762
    },
    "entity_6": {
      "CompositionType": "ELEMENT",
      "Elevation": 0.0
    }
  },
  "containment": [
    {
      "entity": "entity_2",
      "container": "entity_4"
    },
    {
      "entity": "entity_3",
      "container": "entity_4"
    },
    {
      "entity": "entity_5",
      "container": "entity_4"
    },
    {
      "entity": "entity_0",
      "container": "entity_6"
    },
    {
      "entity": "entity_1",
      "container": "entity_6"
    }
  ],
  "connectivity": [],
  "constraints": [
    "entity_4 IfcRelContainedInSpatialStructure entity_2",
    "entity_4 IfcRelContainedInSpatialStructure entity_3",
    "entity_4 IfcRelContainedInSpatialStructure entity_5",
    "entity_6 IfcRelContainedInSpatialStructure entity_0",
    "entity_6 IfcRelContainedInSpatialStructure entity_1"
  ],
  "generation_prompt": "Generate a variable speed drive fan. Technical 3D scene containing IfcBuildingStorey, IfcDoor",
  "prompt_id": "T1-HVAC-004",
  "prompt": "Generate a variable speed drive fan",
  "tier": 1,
  "domain": "MEP"
}