{
  "entities": [
    {
      "id": "entity_0",
      "ifc_type": "IfcCovering",
      "name": "Compound Ceiling:Gypsum Board:187675",
      "position": [
        0.0,
        0.0,
        0.0
      ],
      "attributes": {
        "ObjectType": "Compound Ceiling:Gypsum Board",
        "Tag": "187675",
        "PredefinedType": "CEILING"
      }
    },
    {
      "id": "entity_1",
      "ifc_type": "IfcSpace",
      "name": "R301",
      "position": [
        2.0,
        0.0,
        0.0
      ],
      "attributes": {
        "LongName": "Roof",
        "CompositionType": "ELEMENT",
        "InteriorOrExteriorSpace": "INTERNAL"
      }
    },
    {
      "id": "entity_2",
      "ifc_type": "IfcSpace",
      "name": "B205",
      "position": [
        4.0,
        0.0,
        0.0
      ],
      "attributes": {
        "LongName": "Utility",
        "CompositionType": "ELEMENT",
        "InteriorOrExteriorSpace": "INTERNAL"
      }
    },
    {
      "id": "entity_3",
      "ifc_type": "IfcCovering",
      "name": "Compound Ceiling:Gypsum Board:187667",
      "position": [
        6.0,
        0.0,
        0.0
      ],
      "attributes": {
        "ObjectType": "Compound Ceiling:Gypsum Board",
        "Tag": "187667",
        "PredefinedType": "CEILING"
      }
    },
    {
      "id": "entity_4",
      "ifc_type": "IfcSpace",
      "name": "A205",
      "position": [
        8.0,
        0.0,
        0.0
      ],
      "attributes": {
        "LongName": "Utility",
        "CompositionType": "ELEMENT",
        "InteriorOrExteriorSpace": "INTERNAL"
      }
    },
    {
      "id": "entity_5",
      "ifc_type": "IfcBuildingStorey",
      "name": "Level 2",
      "position": [
        10.0,
        0.0,
        0.0
      ],
      "attributes": {
        "CompositionType": "ELEMENT",
        "Elevation": 3.100000000000378
      }
    },
    {
      "id": "entity_6",
      "ifc_type": "IfcBuildingStorey",
      "name": "Roof",
      "position": [
        12.0,
        0.0,
        0.0
      ],
      "attributes": {
        "CompositionType": "ELEMENT",
        "Elevation": 6.00000000000039
      }
    }
  ],
  "relations": [
    {
      "type": "IfcRelContainedInSpatialStructure",
      "from": "entity_5",
      "to": "entity_3",
      "attributes": {}
    },
    {
      "type": "IfcRelContainedInSpatialStructure",
      "from": "entity_5",
      "to": "entity_0",
      "attributes": {}
    },
    {
      "type": "IfcRelAggregates",
      "from": "entity_5",
      "to": "entity_4",
      "attributes": {}
    },
    {
      "type": "IfcRelAggregates",
      "from": "entity_5",
      "to": "entity_2",
      "attributes": {}
    },
    {
      "type": "IfcRelAggregates",
      "from": "entity_6",
      "to": "entity_1",
      "attributes": {}
    }
  ],
  "attributes": {
    "entity_0": {
      "ObjectType": "Compound Ceiling:Gypsum Board",
      "Tag": "187675",
      "PredefinedType": "CEILING"
    },
    "entity_1": {
      "LongName": "Roof",
      "CompositionType": "ELEMENT",
      "InteriorOrExteriorSpace": "INTERNAL"
    },
    "entity_2": {
      "LongName": "Utility",
      "CompositionType": "ELEMENT",
      "InteriorOrExteriorSpace": "INTERNAL"
    },
    "entity_3": {
      "ObjectType": "Compound Ceiling:Gypsum Board",
      "Tag": "187667",
      "PredefinedType": "CEILING"
    },
    "entity_4": {
      "LongName": "Utility",
      "CompositionType": "ELEMENT",
      "InteriorOrExteriorSpace": "INTERNAL"
    },
    "entity_5": {
      "CompositionType": "ELEMENT",
      "Elevation": 3.100000000000378
    },
    "entity_6": {
      "CompositionType": "ELEMENT",
      "Elevation": 6.00000000000039
    }
  },
  "containment": [
    {
      "entity": "entity_3",
      "container": "entity_5"
    },
    {
      "entity": "entity_0",
      "container": "entity_5"
    }
  ],
  "connectivity": [],
  "constraints": [
    "entity_5 IfcRelContainedInSpatialStructure entity_3",
    "entity_5 IfcRelContainedInSpatialStructure entity_0",
    "entity_5 IfcRelAggregates entity_4",
    "entity_5 IfcRelAggregates entity_2",
    "entity_6 IfcRelAggregates entity_1"
  ],
  "generation_prompt": "Generate a split-system outdoor condenser unit. Technical 3D scene containing IfcBuildingStorey, IfcCovering, IfcSpace",
  "prompt_id": "T1-HVAC-011",
  "prompt": "Generate a split-system outdoor condenser unit",
  "tier": 1,
  "domain": "MEP"
}