{
  "entities": [
    {
      "id": "entity_0",
      "ifc_type": "IfcFurnishingElement",
      "name": "M_Vanity Cabinet-Double Door Sink Unit:650 x 450 mm:650 x 450 mm:205239",
      "position": [
        0.0,
        0.0,
        0.0
      ],
      "attributes": {
        "ObjectType": "650 x 450 mm",
        "Tag": "205239"
      }
    },
    {
      "id": "entity_1",
      "ifc_type": "IfcSpace",
      "name": "B205",
      "position": [
        2.0,
        0.0,
        0.0
      ],
      "attributes": {
        "LongName": "Utility",
        "CompositionType": "ELEMENT",
        "InteriorOrExteriorSpace": "INTERNAL"
      }
    },
    {
      "id": "entity_2",
      "ifc_type": "IfcSpace",
      "name": "A205",
      "position": [
        4.0,
        0.0,
        0.0
      ],
      "attributes": {
        "LongName": "Utility",
        "CompositionType": "ELEMENT",
        "InteriorOrExteriorSpace": "INTERNAL"
      }
    },
    {
      "id": "entity_3",
      "ifc_type": "IfcBuildingStorey",
      "name": "Level 2",
      "position": [
        6.0,
        0.0,
        0.0
      ],
      "attributes": {
        "CompositionType": "ELEMENT",
        "Elevation": 3.100000000000378
      }
    },
    {
      "id": "entity_4",
      "ifc_type": "IfcSpace",
      "name": "B104",
      "position": [
        8.0,
        0.0,
        0.0
      ],
      "attributes": {
        "LongName": "Bathroom 1",
        "CompositionType": "ELEMENT",
        "InteriorOrExteriorSpace": "INTERNAL"
      }
    },
    {
      "id": "entity_5",
      "ifc_type": "IfcFurnishingElement",
      "name": "M_Vanity Cabinet-Double Door Sink Unit:650 x 450 mm:650 x 450 mm:205265",
      "position": [
        10.0,
        0.0,
        0.0
      ],
      "attributes": {
        "ObjectType": "650 x 450 mm",
        "Tag": "205265"
      }
    },
    {
      "id": "entity_6",
      "ifc_type": "IfcFurnishingElement",
      "name": "M_Vanity Cabinet-Double Door Sink Unit:650 x 450 mm:650 x 450 mm:205264",
      "position": [
        12.0,
        0.0,
        0.0
      ],
      "attributes": {
        "ObjectType": "650 x 450 mm",
        "Tag": "205264"
      }
    },
    {
      "id": "entity_7",
      "ifc_type": "IfcFurnishingElement",
      "name": "M_Vanity Cabinet-Double Door Sink Unit:650 x 450 mm:650 x 450 mm:204934",
      "position": [
        14.0,
        0.0,
        0.0
      ],
      "attributes": {
        "ObjectType": "650 x 450 mm",
        "Tag": "204934"
      }
    },
    {
      "id": "entity_8",
      "ifc_type": "IfcSpace",
      "name": "B204",
      "position": [
        16.0,
        0.0,
        0.0
      ],
      "attributes": {
        "LongName": "Bathroom 2",
        "CompositionType": "ELEMENT",
        "InteriorOrExteriorSpace": "INTERNAL"
      }
    },
    {
      "id": "entity_9",
      "ifc_type": "IfcBuildingStorey",
      "name": "Level 1",
      "position": [
        18.0,
        0.0,
        0.0
      ],
      "attributes": {
        "CompositionType": "ELEMENT",
        "Elevation": 0.0
      }
    },
    {
      "id": "entity_10",
      "ifc_type": "IfcSpace",
      "name": "A204",
      "position": [
        20.0,
        0.0,
        0.0
      ],
      "attributes": {
        "LongName": "Bathroom 2",
        "CompositionType": "ELEMENT",
        "InteriorOrExteriorSpace": "INTERNAL"
      }
    }
  ],
  "relations": [
    {
      "type": "IfcRelAggregates",
      "from": "entity_3",
      "to": "entity_10",
      "attributes": {}
    },
    {
      "type": "IfcRelAggregates",
      "from": "entity_3",
      "to": "entity_8",
      "attributes": {}
    },
    {
      "type": "IfcRelAggregates",
      "from": "entity_3",
      "to": "entity_2",
      "attributes": {}
    },
    {
      "type": "IfcRelAggregates",
      "from": "entity_3",
      "to": "entity_1",
      "attributes": {}
    },
    {
      "type": "IfcRelContainedInSpatialStructure",
      "from": "entity_8",
      "to": "entity_7",
      "attributes": {}
    },
    {
      "type": "IfcRelContainedInSpatialStructure",
      "from": "entity_8",
      "to": "entity_0",
      "attributes": {}
    },
    {
      "type": "IfcRelAggregates",
      "from": "entity_9",
      "to": "entity_4",
      "attributes": {}
    },
    {
      "type": "IfcRelContainedInSpatialStructure",
      "from": "entity_10",
      "to": "entity_6",
      "attributes": {}
    },
    {
      "type": "IfcRelContainedInSpatialStructure",
      "from": "entity_10",
      "to": "entity_5",
      "attributes": {}
    }
  ],
  "attributes": {
    "entity_0": {
      "ObjectType": "650 x 450 mm",
      "Tag": "205239"
    },
    "entity_1": {
      "LongName": "Utility",
      "CompositionType": "ELEMENT",
      "InteriorOrExteriorSpace": "INTERNAL"
    },
    "entity_2": {
      "LongName": "Utility",
      "CompositionType": "ELEMENT",
      "InteriorOrExteriorSpace": "INTERNAL"
    },
    "entity_3": {
      "CompositionType": "ELEMENT",
      "Elevation": 3.100000000000378
    },
    "entity_4": {
      "LongName": "Bathroom 1",
      "CompositionType": "ELEMENT",
      "InteriorOrExteriorSpace": "INTERNAL"
    },
    "entity_5": {
      "ObjectType": "650 x 450 mm",
      "Tag": "205265"
    },
    "entity_6": {
      "ObjectType": "650 x 450 mm",
      "Tag": "205264"
    },
    "entity_7": {
      "ObjectType": "650 x 450 mm",
      "Tag": "204934"
    },
    "entity_8": {
      "LongName": "Bathroom 2",
      "CompositionType": "ELEMENT",
      "InteriorOrExteriorSpace": "INTERNAL"
    },
    "entity_9": {
      "CompositionType": "ELEMENT",
      "Elevation": 0.0
    },
    "entity_10": {
      "LongName": "Bathroom 2",
      "CompositionType": "ELEMENT",
      "InteriorOrExteriorSpace": "INTERNAL"
    }
  },
  "containment": [
    {
      "entity": "entity_7",
      "container": "entity_8"
    },
    {
      "entity": "entity_0",
      "container": "entity_8"
    },
    {
      "entity": "entity_6",
      "container": "entity_10"
    },
    {
      "entity": "entity_5",
      "container": "entity_10"
    }
  ],
  "connectivity": [],
  "constraints": [
    "entity_3 IfcRelAggregates entity_10",
    "entity_3 IfcRelAggregates entity_8",
    "entity_3 IfcRelAggregates entity_2",
    "entity_3 IfcRelAggregates entity_1",
    "entity_8 IfcRelContainedInSpatialStructure entity_7",
    "entity_8 IfcRelContainedInSpatialStructure entity_0",
    "entity_9 IfcRelAggregates entity_4",
    "entity_10 IfcRelContainedInSpatialStructure entity_6",
    "entity_10 IfcRelContainedInSpatialStructure entity_5"
  ],
  "generation_prompt": "Generate a heat exchanger unit. Technical 3D scene containing IfcBuildingStorey, IfcFurnishingElement, IfcSpace",
  "prompt_id": "T1-MEP-016",
  "prompt": "Generate a heat exchanger unit",
  "tier": 1,
  "domain": "MEP"
}