{
  "entities": [
    {
      "id": "entity_0",
      "ifc_type": "IfcSpace",
      "name": "A104",
      "position": [
        0.0,
        0.0,
        0.0
      ],
      "attributes": {
        "LongName": "Bathroom 1",
        "CompositionType": "ELEMENT",
        "InteriorOrExteriorSpace": "INTERNAL"
      }
    },
    {
      "id": "entity_1",
      "ifc_type": "IfcSpace",
      "name": "B105",
      "position": [
        2.0,
        0.0,
        0.0
      ],
      "attributes": {
        "LongName": "Room",
        "CompositionType": "ELEMENT",
        "InteriorOrExteriorSpace": "INTERNAL"
      }
    },
    {
      "id": "entity_2",
      "ifc_type": "IfcSpace",
      "name": "B201",
      "position": [
        4.0,
        0.0,
        0.0
      ],
      "attributes": {
        "LongName": "Hallway",
        "CompositionType": "ELEMENT",
        "InteriorOrExteriorSpace": "INTERNAL"
      }
    },
    {
      "id": "entity_3",
      "ifc_type": "IfcBuildingStorey",
      "name": "Level 2",
      "position": [
        6.0,
        0.0,
        0.0
      ],
      "attributes": {
        "CompositionType": "ELEMENT",
        "Elevation": 3.100000000000378
      }
    },
    {
      "id": "entity_4",
      "ifc_type": "IfcSpace",
      "name": "B104",
      "position": [
        8.0,
        0.0,
        0.0
      ],
      "attributes": {
        "LongName": "Bathroom 1",
        "CompositionType": "ELEMENT",
        "InteriorOrExteriorSpace": "INTERNAL"
      }
    },
    {
      "id": "entity_5",
      "ifc_type": "IfcFurnishingElement",
      "name": "M_Vanity Cabinet-Double Door Sink Unit:450 x 450 mm:450 x 450 mm:205548",
      "position": [
        10.0,
        0.0,
        0.0
      ],
      "attributes": {
        "ObjectType": "450 x 450 mm",
        "Tag": "205548"
      }
    },
    {
      "id": "entity_6",
      "ifc_type": "IfcSpace",
      "name": "A105",
      "position": [
        12.0,
        0.0,
        0.0
      ],
      "attributes": {
        "LongName": "Stair",
        "CompositionType": "ELEMENT",
        "InteriorOrExteriorSpace": "INTERNAL"
      }
    },
    {
      "id": "entity_7",
      "ifc_type": "IfcBuildingStorey",
      "name": "Level 1",
      "position": [
        14.0,
        0.0,
        0.0
      ],
      "attributes": {
        "CompositionType": "ELEMENT",
        "Elevation": 0.0
      }
    }
  ],
  "relations": [
    {
      "type": "IfcRelContainedInSpatialStructure",
      "from": "entity_0",
      "to": "entity_5",
      "attributes": {}
    },
    {
      "type": "IfcRelAggregates",
      "from": "entity_3",
      "to": "entity_2",
      "attributes": {}
    },
    {
      "type": "IfcRelAggregates",
      "from": "entity_7",
      "to": "entity_0",
      "attributes": {}
    },
    {
      "type": "IfcRelAggregates",
      "from": "entity_7",
      "to": "entity_4",
      "attributes": {}
    },
    {
      "type": "IfcRelAggregates",
      "from": "entity_7",
      "to": "entity_6",
      "attributes": {}
    },
    {
      "type": "IfcRelAggregates",
      "from": "entity_7",
      "to": "entity_1",
      "attributes": {}
    }
  ],
  "attributes": {
    "entity_0": {
      "LongName": "Bathroom 1",
      "CompositionType": "ELEMENT",
      "InteriorOrExteriorSpace": "INTERNAL"
    },
    "entity_1": {
      "LongName": "Room",
      "CompositionType": "ELEMENT",
      "InteriorOrExteriorSpace": "INTERNAL"
    },
    "entity_2": {
      "LongName": "Hallway",
      "CompositionType": "ELEMENT",
      "InteriorOrExteriorSpace": "INTERNAL"
    },
    "entity_3": {
      "CompositionType": "ELEMENT",
      "Elevation": 3.100000000000378
    },
    "entity_4": {
      "LongName": "Bathroom 1",
      "CompositionType": "ELEMENT",
      "InteriorOrExteriorSpace": "INTERNAL"
    },
    "entity_5": {
      "ObjectType": "450 x 450 mm",
      "Tag": "205548"
    },
    "entity_6": {
      "LongName": "Stair",
      "CompositionType": "ELEMENT",
      "InteriorOrExteriorSpace": "INTERNAL"
    },
    "entity_7": {
      "CompositionType": "ELEMENT",
      "Elevation": 0.0
    }
  },
  "containment": [
    {
      "entity": "entity_5",
      "container": "entity_0"
    }
  ],
  "connectivity": [],
  "constraints": [
    "entity_0 IfcRelContainedInSpatialStructure entity_5",
    "entity_3 IfcRelAggregates entity_2",
    "entity_7 IfcRelAggregates entity_0",
    "entity_7 IfcRelAggregates entity_4",
    "entity_7 IfcRelAggregates entity_6",
    "entity_7 IfcRelAggregates entity_1"
  ],
  "generation_prompt": "Generate a duct-mounted smoke damper. Technical 3D scene containing IfcBuildingStorey, IfcFurnishingElement, IfcSpace",
  "prompt_id": "T1-HVAC-007",
  "prompt": "Generate a duct-mounted smoke damper",
  "tier": 1,
  "domain": "MEP"
}